"Story","Title","Result","Date","Stability","Duration (s)"
"Upload Photo","As a user I can upload photo with a valid path","SUCCESS","2023-12-20T03:59:26.878247+07:00[Asia/Jakarta]","0.0","3.89"
"Upload Photo","As a user I can't upload photo without path","SUCCESS","2023-12-20T03:59:30.782649+07:00[Asia/Jakarta]","0.0","0.97"
"Upload Photo","As a user I can't upload photo if I don't fill in the upload photo request","SUCCESS","2023-12-20T03:59:31.773973+07:00[Asia/Jakarta]","0.0","1.09"
"Upload Photo","As a user I can't upload photo if the photo request format is not appropriate (e.g. other than","SUCCESS","2023-12-20T03:59:32.881713+07:00[Asia/Jakarta]","0.0","1.27"
"Upload Photo","As a user I can't upload photo if size more than 5 MB","SUCCESS","2023-12-20T03:59:34.160653+07:00[Asia/Jakarta]","0.0","33.07"
