"Story","Title","Result","Date","Stability","Duration (s)"
"Create New Favorite","As a user I can create new favorite with a valid path","SUCCESS","2023-12-18T11:14:29.408546+07:00[Asia/Jakarta]","0.0","1.71"
"Create New Favorite","As a user I can't create new favorite without path","SUCCESS","2023-12-18T11:14:31.158981+07:00[Asia/Jakarta]","0.0","1.31"
"Create New Favorite","As a user I can't create new favorite if I don't fill in the create new favorite request","SUCCESS","2023-12-18T11:14:32.47751+07:00[Asia/Jakarta]","0.0","1.18"
"Delete Favorite By ID","As a user I can delete favorite by ID with a valid path","SUCCESS","2023-12-18T11:14:33.68662+07:00[Asia/Jakarta]","0.0","1.64"
"Delete Favorite By ID","As a user I can't delete favorite by ID without path","SUCCESS","2023-12-18T11:14:35.336188+07:00[Asia/Jakarta]","0.0","1.26"
"Delete Favorite By ID","As a user I can't delete favorite by ID with invalid ID","SUCCESS","2023-12-18T11:14:36.624371+07:00[Asia/Jakarta]","0.0","1.33"
"Get List Favorite","As a user I can get list favorite with a valid path","SUCCESS","2023-12-18T11:14:37.972204+07:00[Asia/Jakarta]","0.0","2.28"
"Get List Favorite","As a user I can't get list favorite without path","SUCCESS","2023-12-18T11:14:40.292402+07:00[Asia/Jakarta]","0.0","1.13"
